{
  "$schema": "https://shadcn-cssinjs.com/schema.json",
  "engine": "stylex",
  "style": "stylex",
  "rsc": true,
  "tsx": true,
  "tailwind": {
    "config": "",
    "css": "styles/globals.css",
    "baseColor": "",
    "cssVariables": true,
    "prefix": ""
  },
  "aliases": {
    "components": "@/components",
    "utils": "@/lib/utils",
    "ui": "@/components/ui",
    "lib": "@/lib",
    "hooks": "@/hooks"
  },
  "iconLibrary": "lucide"
}
